{
  "credit": "CREDIT-1",
  "publisher": { "type": "company", "id": "example.com", "name": "Example Inc", "url": "https://example.com" },
  "credits": [
    { "to": { "type": "github", "id": "fitzyracing1" }, "for": "CREDIT-1 standard", "date": "2026-10-23", "weight": 3 },
    { "to": { "type": "github", "id": "foundry-rs/foundry" }, "for": "CI testing", "date": "2026-09-01" }
  ],
  "signature": { "alg": "ed25519", "key": "base64-public-key-placeholder", "sig": "base64-signature-placeholder" }
}
